{
  "record_type": "contract", "schema_version": "io.nisavid.sacrysty.public-record/v1",
  "record_id": "io.nisavid.sacrysty.contract:unnamespaced-extension", "publisher": "io.nisavid.sacrysty", "version": "0.1.0",
  "body": {"name": "hostile"},
  "extensions": {"run": {"state": "inert", "version": "1.0.0", "criticality": "optional"}}
}
