{
  "record_type": "contract",
  "schema_version": "io.nisavid.sacrysty.public-record/v1",
  "record_id": "io.nisavid.sacrysty.contract:large-exponent-fixture",
  "publisher": "io.nisavid.sacrysty",
  "body": {"name": "large-exponent-inert-extension"},
  "extensions": {
    "example.invalid.audit": {
      "state": "inert",
      "version": "1.0.0",
      "criticality": "optional",
      "metadata": {"finite_value": 1e400}
    }
  }
}
